{
  "property": "background-color",
  "value": {
    "kind": "token",
    "path": "color.semantic.fill.brand.default"
  },
  "important": false,
  "origin": {
    "recipeId": "button",
    "slot": "root",
    "stage": "variant",
    "source": "recipes/button.ts#/variants/tone/primary/root/backgroundColor"
  }
}
